{
  "$comment": "Tela-owned contract. Update runtime validation, tests and interface documentation together.",
  "$schema": "https://json-schema.org/draft/2020-12/schema",
  "title": "CapabilityToken",
  "description": "Short-lived capability token presented by an upstream client to bind a Tela connection to a capability profile.",
  "type": "object",
  "required": ["token_id", "profile_id", "persona_ref", "instance_id", "issued_at", "expires_at", "token_version", "signature"],
  "properties": {
    "token_id": {
      "type": "string",
      "pattern": "^tok_",
      "description": "Unique token identifier."
    },
    "profile_id": {
      "type": "string",
      "description": "Identifier of the tela capability profile this token grants access to."
    },
    "persona_ref": {
      "type": "string",
      "description": "Reference to the PersonaSpec for the dispatched run."
    },
    "instance_id": {
      "type": "string",
      "description": "Agent instance this token is bound to. One token per instance."
    },
    "max_depth": {
      "type": "integer",
      "description": "Maximum sub-agent depth this token permits",
      "minimum": 0
    },
    "issued_at": {
      "type": "string",
      "format": "date-time",
      "description": "Token issuance time"
    },
    "expires_at": {
      "type": "string",
      "format": "date-time",
      "description": "Token expiration time. tela rejects expired tokens."
    },
    "token_version": {
      "type": "string",
      "const": "0.1.0",
      "description": "Schema version. Consumers must reject unknown versions."
    },
    "signature": {
      "type": "string",
      "description": "Cryptographic signature used to validate token authenticity and integrity."
    }
  },
  "additionalProperties": false
}
