{
  "token_id": "tok_example_profile_developer",
  "profile_id": "developer",
  "persona_ref": "persona.developer",
  "instance_id": "inst-developer",
  "issued_at": "2026-04-15T00:00:00Z",
  "expires_at": "2026-04-15T01:00:00Z",
  "token_version": "0.1.0",
  "signature": "example_hmac_sha256_signature"
}
